{
  "timestamp": "2025-10-31T23:34:15.123Z",
  "region": "NorthEast",
  "site_id": "NE_SITE_003",
  "packet_loss_pct": 2.34,
  "latency_ms": 45.67,
  "jitter_ms": 3.21,
  "cpu_load_pct": 62.5,
  "mem_used_pct": 71.2,
  "calls_dropped": 0,
  "throughput_mbps": 487.3,
  "backhaul_util_pct": 58.9,
  "trace_id": "trace_20251031_233415_abc123"
}
